id,question
261,What types of fat should I use for pan-frying and why?
261,Is pan-frying suitable for smaller portions of food?
261,How does pan-frying differ from sautéing in terms of temperature and fat usage?
261,What is the significance of smoke points in choosing fats for pan-frying?
262,Can you explain how ham is prepared compared to gammon?
262,What part of the hog does bacon come from?
262,Is there a specific curing process for both ham and gammon?
262,Does the smoking process differ between ham and gammon?
262,What is the ideal lean-to-fat ratio for bacon?
263,What dishes benefit from shredding vegetables?
263,Are there specific vegetables that are best when shredded?
263,How does shredding affect cooking time for vegetables?
263,Can shredded vegetables be used in recipes other than salads?
263,What techniques can I use to shred vegetables effectively?
264,What benefits does steaming offer when preparing green vegetables?
264,How does steaming affect the nutritional content of vegetables?
264,Why is timing important when steaming vegetables?
264,What happens to the color and flavor of overcooked steamed vegetables?
264,Can steaming help maintain the shape of vegetables during cooking?
265,What happens if oil temperature is too high during frying?
265,How can I determine the ideal frying temperature for different foods?
265,What are the consequences of using oil past its smoke point?
265,Why is it essential to monitor oil temperature for food safety?
265,What measures can I take to maintain consistent frying temperature?
266,What are the different plant parts used to classify vegetables in cooking?
266,How does the classification of vegetables affect their preparation?
266,Can you explain the categories of vegetables in culinary terms?
266,What guidance does vegetable classification provide in meal selection?
266,Why is it important to understand vegetable types in cooking?
267,What methods can I use to keep food free from physical contaminants?
267,How can I effectively remove packaging materials from ingredients?
267,Are there specific practices I should follow to avoid unwanted materials in my dish?
267,What is the best way to handle herbs and spices to prevent contamination?
267,How do I ensure my cooking process is safe from physical hazards?
268,What temperature should I use to air fry thick-cut fries?
268,How long do I need to cook 17 oz of thick-cut french fries in the air fryer?
268,Are there any tips for making thick-cut fries crispier in an air fryer?
268,Can I season the thick-cut french fries before air frying them?
268,What should I do if my fries are not cooking evenly in the air fryer?
269,What is the role of sugar in meringue preparation?
269,How does the sugar amount influence the consistency of meringue?
269,What is the sugar ratio for creating soft versus hard meringues?
269,Can you explain the differences between soft and hard meringue textures?
269,How much sugar should I use if I want a drier meringue?
270,What is a CCP in cooking processes?
270,How can I identify hazards in food preparation?
270,What steps do I follow to create a decision tree?
270,Why is it important to manage CCPs in cooking?
270,Can you explain how to reduce hazards at different steps?
271,What is the process for whipping egg whites to stiff peaks?
271,How much sugar do I need to add for each egg white in meringue cookies?
271,What temperature should I set the oven to when baking meringue shells?
271,How can I tell when the meringue cookies are done baking?
271,What is the best way to cool hard meringue cookies after baking?
272,What is the best method to prepare whole beets?
272,How can I tell when whole beets are done cooking?
272,Is steaming beets better than boiling for tenderness?
272,Can I peel beets before cooking them?
272,What seasoning goes well with cooked beets?
273,What is the best method for cooking carrots for tenderness?
273,How long should I boil carrots to make them tender?
273,Is steaming carrots an effective way to achieve tenderness?
273,What is the roasting time needed for tender carrots?
273,Can you recommend a covered cooking technique for carrots?
274,What type of tomatoes should I select for enhanced taste?
274,Can vine-ripened tomatoes be consumed raw in dishes?
274,What is the process for blanching tomatoes to remove their skin?
274,How do tomatoes contribute to different types of dishes?
274,What cooking methods enhance the flavor of vine-ripened tomatoes?
275,What types of food are best suited for frying?
275,Can you explain the different frying techniques used in cooking?
275,How do you ensure food maintains its texture when frying?
275,What temperatures are ideal for frying various foods?
275,What are some common mistakes to avoid when frying?
276,How can I use young turnips in a salad?
276,What is the best method for cooking mature turnips for a stew?
276,Which herbs pair well with turnips to enhance their flavor?
276,Can I use turnips in combination with mild acids for a side dish?
276,What are some good recipes that include turnips as a main ingredient?
277,What are the main features of shallow frying?
277,Can you explain the techniques involved in sautéing?
277,How does the process of griddle cooking differ from shallow frying?
277,What types of food are best suited for stir-frying?
277,What equipment do I need for shallow frying?
278,What are the reasons microwaving doesn’t retain meat juiciness?
278,How does microwaving affect the surface browning of meats?
278,Can microwaving ensure meats reach safe internal temperatures?
278,What traditional flavors or textures are lost when microwaving meats?
278,Are there any tools that can improve the appearance of microwaved meats?
279,What temperature should I set the air fryer to for kale?
279,How long does it take to air fry kale for crispiness?
279,Can I use a different temperature for air frying kale leaves?
279,Is there a specific method to prepare kale before air frying?
279,Should I season kale before air frying for better flavor?
280,What should I look for to identify fresh eggs?
280,How can I tell if an egg is of good quality?
280,Where can I find reputable sources for eggs?
280,How long can I keep eggs before they go bad?
280,What are the signs of stale or spoiled eggs?
281,What ingredients do I need for a soft meringue topping?
281,At what temperature should I bake the meringue on the pie?
281,How long should I bake the meringue to achieve a light browning?
281,What does the term 'soft-peak stage' mean in meringue making?
281,Can I use any type of pie filling with the meringue topping?
282,What is the best method to cook leeks for tenderness?
282,How do I steam leeks and for how long?
282,"Can I roast leeks instead, and what is the time required?"
282,What cooking method makes leeks the softest?
282,How do I know when leeks are fully cooked and tender?
283,What temperature is ideal for grilling a 3/4-inch Rib Eye Steak?
283,How do I know when the Rib Eye Steak is done grilling?
283,Can I grill a Rib Eye Steak that is thicker than 3/4 inch?
283,What should I do before grilling a Rib Eye Steak?
283,Is there a recommended resting time after grilling the steak?
284,What temperature is ideal for grilling trout or snapper?
284,Should I turn the fish while grilling it?
284,How many minutes do I need to grill a whole fish?
284,Can I grill trout and snapper the same way?
284,What type of seasoning works well with grilled fish?
285,What is the steaming time for fresh carrots?
285,How do frozen carrots differ in steaming time?
285,Can I steam whole carrots instead of sliced?
285,What happens if I steam carrots for too long?
285,Is steaming better than boiling for preserving nutrients in carrots?
286,What temperature is ideal for air frying cauliflower florets?
286,How long do I need to cook cauliflower florets in an air fryer?
286,Is there a recommended cooking time for air frying cauliflower?
286,What is the best method to cook cauliflower florets in an air fryer?
286,Can I air fry cauliflower florets at a different temperature?
287,What is the best way to clean a heart before cooking it?
287,Can you explain how to prepare tongue for a sandwich?
287,What cooking methods work best for heart and tongue?
287,How long should I simmer tongue for it to be tender?
287,What are some dishes that feature cooked tongue?
288,What is the best way to wash raw vegetables before cooking?
288,Should I remove outer leaves from fruits before cleaning them?
288,How do I properly immerse raw fruits in water for cleaning?
288,Is it necessary to rinse fruits after soaking in cold water?
288,What steps should I take to ensure vegetables are dry after washing?
289,What types of meats are classified as cold cuts?
289,How long can cold cuts be safely stored in the fridge?
289,What is the best way to store cold cuts to maintain freshness?
289,Are there any specific cold cuts that require different storage methods?
289,How can I tell if cold cuts have gone bad?
290,What factors can enhance the digestibility of vegetables when cooking?
290,How does cooking improve the texture of different vegetables?
290,What techniques can be used to preserve nutrients while cooking vegetables?
290,Why is it important to kill microorganisms when preparing vegetables?
290,In what ways can cooking vegetables affect their flavor and color?
291,What spices can enhance the flavor of roasted vegetables?
291,Are there any specific herbs that pair well with roasted vegetables?
291,How can I adjust the seasoning for different types of vegetables?
291,Can I use fresh herbs instead of dried for the roasted veggies?
291,What is the best way to experiment with spice combinations for roasting?
292,What temperature should frozen fish be stored at to ensure quality?
292,How can I tell if frozen fish has freezer burn?
292,Is it safe to refreeze fish once it has been thawed?
292,What are the signs of fresh fish smell when using frozen products?
292,What is the best way to thaw frozen fish without compromising quality?
293,What makes braising important for food texture?
293,How does braising improve the quality of a dish?
293,Can you explain the benefits of using braising in cooking?
293,Why is variety in cooking techniques like braising significant?
293,What types of food are best suited for braising?
294,What techniques help retain the color of red vegetables during cooking?
294,How can I prepare beets to keep their vibrant color?
294,What is the impact of cooking time on the color of red vegetables?
294,Why is it important to use minimal water when cooking red vegetables?
294,How can cooking liquids be used to enhance the color of vegetables?
295,What temperature should I set the grill for salmon?
295,How long do I grill the salmon fillets skin-side down?
295,Should I flip the salmon fillets while grilling?
295,What are the best seasoning options for grilled salmon?
295,Can I use frozen salmon fillets for this recipe?
296,What temperature should I set the grill for fish steaks?
296,How long do I need to grill salmon or halibut steaks?
296,"Do I need to turn the fish while grilling, and if so, how often?"
296,Is there a specific way to prepare the fish before grilling?
296,Can you suggest any side dishes that pair well with grilled fish steaks?
297,What are the key differences between a stew and a braise?
297,Can you explain how simmering is different from stewing?
297,What types of meat are best for stewing?
297,Why do white stews skip the browning process?
297,How much liquid is typically used in a stew compared to braising?
298,What technique should I use to fold egg whites effectively?
298,How can I avoid deflating the egg whites when mixing?
298,Is there a specific movement to use when incorporating egg whites?
298,What should I do if there are still white streaks in the mixture?
298,Can I use a different bowl for folding egg whites and heavier mixture?
299,What types of cuts can I achieve with a mandolin in vegetable preparation?
299,How do the adjustable blades of a mandolin improve cooking results?
299,Can a mandolin help with food presentation when slicing vegetables?
299,Are there specific vegetables that are best suited for a mandolin?
299,What safety tips should I consider when using a mandolin for slicing?
300,What temperature should I set the air fryer for asparagus?
300,Is 5 minutes enough time to air fry asparagus slices?
300,Can I air fry asparagus thicker than 1 inch?
300,How can I season asparagus before air frying?
300,What other vegetables can I air fry alongside asparagus?
301,What temperature is best for air frying Brussels sprouts?
301,How long does it take to cook halved Brussels sprouts in an air fryer?
301,Can I season Brussels sprouts before air frying them?
301,Should I preheat the air fryer for Brussels sprouts?
301,What is the recommended method for cutting Brussels sprouts for air frying?
302,What is the ideal temperature to grill lobster tails?
302,How can I tell when lobster tails are fully cooked?
302,Should I season lobster tails before grilling them?
302,Is there a difference in cooking time for larger lobster tails?
302,What side dishes pair well with grilled lobster tails?
303,What ingredients are needed to make meringues?
303,How can I prevent my meringues from collapsing?
303,What is the ideal baking temperature for meringues?
303,Can you explain the difference between soft and crisp meringues?
303,How long should meringues cool after baking?
304,What techniques can I use to maintain the texture of vegetables while cooking?
304,How do different cooking methods affect the flavor of vegetables?
304,What are some tips for preserving nutrient content in cooked vegetables?
304,Why is it important to consider cooking times for different types of vegetables?
304,How can I enhance the color of vegetables during the cooking process?
305,How long should I steam kale for the best results?
305,Are there leafy greens that should not be steamed?
305,What are some other cooking methods for Swiss chard?
305,Can I mix different types of leafy greens when steaming?
305,What is the optimal time for cooking collards to achieve tenderness?
306,What oil should I use to coat the vegetables for roasting?
306,Which seasonings work best to enhance roasted vegetable flavor?
306,How long should I roast vegetables for optimal taste?
306,Can I add herbs to the vegetables before roasting?
306,What vegetables caramelize best when roasted?
307,What is the best method to cook cauliflower for tenderness?
307,How do I know if my cauliflower is cooked enough?
307,Can I roast cauliflower instead of boiling it?
307,What time range should I set for boiling cauliflower?
307,Is steaming cauliflower better than boiling for tenderness?
308,What materials are best for wrapping meat before freezing?
308,How long can I safely freeze beef cuts?
308,What is the ideal storage temperature for frozen meat?
308,How should I label meat packages for freezing?
308,What is the recommended freezing time for ground beef?
309,What are the ingredients for making a batter for deep-frying?
309,How can I season flour for coating fried foods?
309,What is the purpose of using breadcrumbs in deep-fried dishes?
309,Can I use different types of flour for coatings in deep-frying?
309,What alternatives exist for coatings besides flour and breadcrumbs?
310,What should I do before I start baking for the best results?
310,How can I ensure that my baked goods cook evenly?
310,Why is it important to grease or line baking tins?
310,What are the common mistakes to avoid in baking?
310,How does the temperature impact baking outcomes?
311,What is the purpose of folding in baking recipes?
311,How does folding affect the texture of mousses?
311,In what situations should I use the folding technique?
311,Can you explain the difference between folding and stirring?
311,Why is it important to maintain airiness while folding ingredients?
312,What techniques are involved in the oven roasting process?
312,How does oven roasting enhance the flavor of meats?
312,Can you explain the benefits of oven roasting vegetables?
312,What types of foods are best suited for oven roasting?
312,Does oven roasting require any special equipment or preparation?
313,What corrective steps can be taken if a limit is not met?
313,How can I adjust the cooking process when critical limits fail?
313,What should I do with products that do not meet safety standards?
313,Is retraining staff necessary when limits are not achieved?
313,What measures can ensure food safety in my cooking process?
314,What types of vegetables are best for roasting?
314,How do I know when the roasted veggies are done?
314,Can I use a different temperature for roasting the vegetables?
314,What are some recommended seasonings to use for roasted veggies?
314,Is it necessary to use oil when roasting vegetables?
315,What are the cooking times for fingerling potatoes using different methods?
315,Can you suggest various ways to prepare fingerling potatoes?
315,What temperature should I use to roast fingerling potatoes?
315,Is it necessary to cover the pot when boiling fingerling potatoes?
315,What are the signs that fingerling potatoes are tender when cooking?
316,How do I begin portioning a chicken effectively?
316,What is the best way to remove a chicken's backbone?
316,Can you explain how to identify the joints in a chicken?
316,What techniques ensure even cooking when cutting chicken?
316,What are the different portion sizes I can achieve with a chicken?
317,What is the best method to cook winter squash varieties until they are soft?
317,How long should I boil or steam winter squash for tenderness?
317,"Can I bake winter squash, and if so, for how long?"
317,Is peeling winter squash necessary before cooking it?
317,What temperature should I use to bake winter squash halves for optimal tenderness?
318,What should I do to keep my sauces from burning on the grill?
318,How can I maintain consistent heat while grilling sauces?
318,Are there specific ingredients that work better for grilled sauces?
318,What steps should I take before adding sauce to the grill?
318,Why is it important not to open the grill lid frequently?
319,What techniques can I use to keep the flavor of my vegetables when cooking?
319,How does steaming affect the flavor of vegetables during cooking?
319,What is the impact of cooking times on vegetable flavor preservation?
319,Why should I cook strong-flavored vegetables uncovered?
319,How can adding sugar help with the flavor of stored vegetables?
320,What temperature should I set the grill to for beef tenderloin?
320,How long should I cook the beef tenderloin for medium doneness?
320,What internal temperature do I need to reach for medium beef tenderloin?
320,Is it necessary to let the beef tenderloin rest after grilling?
320,Can you recommend any sides to serve with grilled beef tenderloin?
321,What role do acids play in maintaining vegetable firmness?
321,How do alkalines impact the texture of vegetables?
321,Why is controlling pH important in cooking vegetables?
321,What are the effects of sugar on vegetable texture?
321,How can I retain nutrients while cooking vegetables?
322,What types of ingredients are best for white braising?
322,Can you explain the blanching process for white braising?
322,What is the role of white stock in white braising?
322,How do I preserve flavors when cooking vegetables?
322,What techniques can be applied to enhance the color of braised dishes?
323,What is the best way to prepare sweet peas for cooking?
323,How long should I steam sweet peas for tenderness?
323,Can I boil sweet peas instead of steaming them?
323,What temperature should I use when cooking sweet peas?
323,Are there any tips for making sweet peas more flavorful while cooking?
324,What is the process for soaking beans and peas before cooking?
324,How long should I soak dried mushrooms in hot water?
324,Can I use the soaking liquid from legumes for anything?
324,What is the main reason to rehydrate dried legumes and vegetables?
324,Are there specific instructions for soaking different types of beans?
325,What cooking methods help prevent fatty fish from becoming greasy?
325,Is it better to fry or bake fatty fish to avoid oiliness?
325,How can I retain moisture while cooking fatty fish?
325,What should I do after frying fatty fish to reduce greasiness?
325,Can broiling fatty fish help in making it less oily?
326,What are the best storage methods for shellfish to ensure quality?
326,How quickly should shellfish be used after purchase to maintain freshness?
326,What temperature is ideal for storing shellfish before cooking?
326,Why is glycogen important in determining the flavor of shellfish?
326,What precautions should I take when handling shellfish in the kitchen?
327,What practices should be followed to prevent waste contamination of food?
327,How can I ensure food safety while managing kitchen waste?
327,What areas should be kept clear of waste products to maintain hygiene?
327,Why is it important to separate waste from food storage?
327,What guidelines should I follow for waste management in a kitchen?
328,How do I start forming a HACCP team for my kitchen?
328,What steps are involved in creating a flow diagram for my dish?
328,Can you explain the hazard analysis needed for my recipe?
328,What are HACCP's seven principles that I should follow?
328,What information should I include when describing my food product?
329,What signs indicate live shellfish are fresh?
329,How can I tell if a bivalve shell is safe to buy?
329,What does it mean if shellfish feel light for their size?
329,Why should there be no chlorine marks on shellfish?
329,Are intact claws necessary when selecting live shellfish?
330,How long should I boil asparagus for the best results?
330,What is the steaming time for asparagus to achieve crisp tenderness?
330,"If I want to roast asparagus, how long should I cook it?"
330,What cooking method is recommended for asparagus besides boiling?
330,Can you tell me the cooking times for both steaming and roasting asparagus?
331,What are some examples of conduction in cooking methods?
331,How does direct contact affect the cooking process through conduction?
331,What are the benefits of using conduction for cooking food?
331,Can you explain how a frying pan utilizes conduction?
331,Are there any disadvantages to cooking with conduction?
332,What is a water bath and how is it used in baking?
332,Why is it important to prevent overcooking in custards?
332,Can you explain the benefits of using a bain-marie?
332,What temperature should the water be for baking custards?
332,Are there other methods for ensuring even heat in baking?
333,What baking techniques can enhance bread texture?
333,How does steam affect the quality of bread during baking?
333,What role does humidity play in baking bread?
333,Can I use water in the oven for better bread results?
333,What tips can help improve the eating quality of my bread?
334,What cooking methods are best for tough offals like heart and tongue?
334,How long should I simmer or braise oxtails for optimal tenderness?
334,What is the importance of breaking down connective tissues in cooking offals?
334,Can you suggest recipes that utilize tenderized tripe?
334,What is the best way to prepare soups using heart or tongue?
335,What wrapping techniques can I use to keep fish moist during baking?
335,Are there specific cooking methods that help retain moisture in baked fish?
335,How does cooking en papillote help with fish dryness?
335,Can you suggest any sauces that work well to prevent fish from drying out?
335,What is the benefit of using a combination oven with steam for baking fish?
336,What effects does heat have on food texture and flavor?
336,How does heating affect the molecular interactions in ingredients?
336,In what ways does increased temperature change the cooking process?
336,Can heat impact the nutritional value of a meal during cooking?
336,What are some cooking methods that utilize heat to alter food's structure?
337,What is the steaming time for fresh cut green beans in bulk?
337,How do I adjust steaming time for frozen green beans?
337,Is it necessary to boil water before steaming green beans?
337,Can you give tips for steaming green beans properly?
337,What happens if I understeam green beans?
338,What temperature should I set for air frying fish sticks?
338,Is 14 minutes the right cooking time for 10 oz of frozen fish sticks?
338,Can I cook different brands of fish sticks the same way?
338,Should I preheat the air fryer before cooking fish sticks?
338,What should I do if the fish sticks are still frozen after 14 minutes?
339,What temperature is ideal for grilling flank steak to achieve medium doneness?
339,How long should I grill flank steak for 145°F internal temperature?
339,"Is resting the flank steak necessary after grilling, and why?"
339,What is the best way to ensure flank steak remains tender after cooking?
339,Can you suggest any side dishes that pair well with grilled flank steak?
340,What are the best cooking techniques for game birds?
340,How can I ensure the meat stays moist while cooking specialty poultry?
340,What does barding mean in the context of cooking game birds?
340,Are there specific marinades that work well with game birds?
340,How does the flavor of game birds differ from regular poultry?
341,What refrigeration guidelines should I follow for meat?
341,How can I avoid cross-contamination when cooking meat?
341,What are the recommended cooking temperatures for various meats?
341,What practices ensure meat quality during handling?
341,Why is it important to follow safety measures for meat preparation?
342,What are some examples of variety meats used in cooking?
342,How can I properly cook liver to maintain tenderness?
342,What is the best way to prepare kidneys for a meal?
342,Why is it important to ensure the freshness of variety meats?
