id,question
0,Can you explain the purpose of HACCP in food safety?
0,How does HACCP identify hazards in food production?
0,What are the key principles of the HACCP system?
0,Why is it important to control hazards in cooking?
0,How can I implement HACCP in my kitchen?
1,Can you explain the different types of frying methods?
1,What foods are best suited for frying?
1,How does frying enhance the flavor of a dish?
1,What are the safety precautions for frying with hot oil?
1,What are the health implications of frying foods?
2,What ingredients are typically used in Navarin stew?
2,How long should I cook the lamb for Navarin?
2,Can I use other meats instead of lamb for Navarin?
2,What type of vegetables work best in a Navarin stew?
2,Is there a specific type of stock recommended for Navarin?
3,Can you explain the role of betalin in vegetables?
3,Which vegetables contain betalin?
3,How does betalin affect the color of beets?
3,Are there health benefits associated with betalin?
3,Can I use betalin in my cooking for color enhancement?
4,What are the best types of food to use for stewing?
4,How long does it typically take to stew food properly?
4,Can you explain the difference between stewing and braising?
4,What are some common spices or herbs used in stewing?
4,Is there a specific type of pot recommended for stewing?
5,Can you explain the process of braising in detail?
5,What types of dishes are best suited for braising?
5,How do I know when the braising liquid is at the right level?
5,What are some common mistakes to avoid when braising?
5,Can I braise meat and vegetables together in one pot?
6,What techniques can I use for pureeing foods?
6,Which types of meals benefit most from pureeing?
6,Can you explain the benefits of pureeing for baby foods?
6,What equipment do I need for pureeing ingredients effectively?
6,Are there any specific recipes that require pureeing as a step?
7,How do I properly fry meat for a Ragoût?
7,What types of red meat are best for making Ragoût?
7,Can I use white wine instead of red wine in a Ragoût?
7,What ingredients can I add to enhance the flavor of my Ragoût?
7,How long should I simmer the Ragoût for optimal tenderness?
8,How do I chiffonade basil leaves correctly?
8,What dishes benefit from using chiffonade cuts?
8,Can you explain the difference between chiffonade and other cutting techniques?
8,What tools are best for achieving a chiffonade cut?
8,Is chiffonade suitable for all types of leafy greens?
9,What are the steps to properly deep fry food?
9,What types of oils are best for deep frying?
9,How do you know when the oil is hot enough for deep frying?
9,Can deep frying be done with a shallow pan?
9,What kinds of foods are suitable for deep frying?
10,What ingredients are best for stir-frying?
10,How do I maintain the texture of vegetables when stir-frying?
10,What type of oil is recommended for stir-frying?
10,How do I know when to add meat during stir-frying?
10,What equipment do I need for stir-frying effectively?
11,What are the benefits of peeling vegetables before cooking?
11,How does peeling affect the flavor of the dish?
11,Which vegetables should always be peeled?
11,Does peeling vegetables change their texture?
11,Are there any vegetables that should not be peeled?
12,What ingredients are typically used in a Blanquette?
12,How do you properly cook the meat for a Blanquette?
12,What kind of sauce is served with a Blanquette?
12,Can I use different types of meat for a Blanquette?
12,What is the best way to make the creamy sauce for a Blanquette?
13,How is Fricassee different from a regular stew?
13,What ingredients do I need to make a Fricassee?
13,Can I use other meats instead of chicken or veal for a Fricassee?
13,What cooking techniques are commonly used in making a Fricassee?
13,How do I ensure the Fricassee has a delicate flavor?
14,Can you explain what pot roasting is in detail?
14,What type of ingredients are typically used for pot roasting?
14,How does pot roasting differ from other cooking methods?
14,What are the benefits of using a covered pan for pot roasting?
14,What root vegetables are best suited for pot roasting?
15,What ingredients do I need for pot roasting?
15,How long does pot roasting usually take?
15,Can I use any type of meat for pot roasting?
15,What vegetables work best for pot roasting?
15,How do I know when the meat is done pot roasting?
16,What are the benefits of grating vegetables for cooking?
16,How does grating affect the texture of vegetables in recipes?
16,Are there specific dishes that require grated vegetables?
16,Can grating vegetables help with cooking time?
16,What tools are best for grating vegetables efficiently?
17,What is the cooking method for a stew?
17,How does the cooking liquid affect the flavor of stewed foods?
17,Can stews be served without their cooking liquid?
17,What types of dishes are typically prepared using stewing?
17,What are the advantages of slow cooking in a stew?
18,How do you prepare coddled eggs correctly?
18,What ingredients can enhance the flavor of coddled eggs?
18,Is it necessary to grease the coddler before cooking the eggs?
18,What temperature should the water be for simmering the coddled eggs?
18,"Can I use different types of eggs for coddling, or does it have to be fresh eggs?"
19,What ingredients are typically used in Bouillabaisse?
19,How do you prepare the fish for Bouillabaisse?
19,What herbs are essential for a flavorful Bouillabaisse?
19,Can you suggest variations of Bouillabaisse for different tastes?
19,What is the ideal cooking time for achieving the perfect broth in Bouillabaisse?
20,Can you explain the ingredients used in Eggs Benedict?
20,What substitutions can be made for ham in Eggs Benedict?
20,How is the hollandaise sauce prepared for Eggs Benedict?
20,What is the best way to poach an egg for Eggs Benedict?
20,"Can Eggs Benedict be made in advance, or should it be served immediately?"
21,How does spit roasting differ from traditional roasting?
21,What types of meat are best for spit roasting?
21,What equipment do I need for spit roasting?
21,Can I use herbs and spices while spit roasting?
21,What are some tips for achieving even cooking while spit roasting?
22,How do you perform a brunoise cut accurately?
22,What types of vegetables are best for a brunoise cut?
22,Can you give examples of dishes that use a brunoise cut?
22,Why is the brunoise cut important in cooking?
22,What tools are recommended for cutting brunoise?
23,How does shallow frying differ from deep frying?
23,What types of food are best for shallow frying?
23,What temperature should the oil be for shallow frying?
23,Can I use a non-stick pan for shallow frying?
23,What is the ideal amount of oil for shallow frying?
24,What delicate items can be used in white braising?
24,How do you prepare vegetables for white braising?
24,What is the difference between white stock and regular stock?
24,Can you explain the process of blanching and refreshing?
24,What root vegetables work best as a bed for braising?
25,What is the technique for sautéing different types of meats?
25,How can I achieve the right temperature when sautéing vegetables?
25,What are some common mistakes to avoid when sautéing food?
25,Can you explain the process of deglazing after sautéing?
25,What types of fat are best for sautéing various ingredients?
26,What types of food are best for barbecuing?
26,How do I prepare the marinade for barbecued dishes?
26,What type of wood is recommended for barbecuing to enhance flavor?
26,Can I use a grill instead of charcoal for barbecuing?
26,How long should I cook meat on a barbecue to ensure it's fully cooked?
27,How thick should each piece be when making a Pont Neuf cut?
27,What types of cooking methods are suitable for Pont Neuf potatoes?
27,Can you explain the dimensions of a traditional Pont Neuf cut?
27,Are there any specific dishes that work well with Pont Neuf potatoes?
27,What is the origin of the term Pont Neuf in relation to cooking?
28,How do I make a bouquet garni for my stew?
28,What herbs can I use in a bouquet garni?
28,Can I add vegetables to my bouquet garni?
28,How long should a bouquet garni be left in the pot?
28,What dishes benefit from using a bouquet garni?
29,What is the process of boiling food?
29,Can you explain the role of liquid in boiling?
29,How can I ensure even cooking while boiling?
29,What types of liquids are ideal for boiling?
29,What are the results of properly boiling food?
30,How does infrared cooking work in transferring heat to food?
30,What are the advantages of using infrared cooking for broiling?
30,Can you explain the difference between infrared cooking and traditional methods?
30,What types of foods are best suited for infrared cooking?
30,Is infrared cooking safe for all types of cookware?
31,What types of food are commonly cooked using a tandoor?
31,How does tandoori cooking affect the flavors of meat?
31,What is the source of heat in tandoori cooking?
31,Can you explain the role of the clay oven in tandoori cuisine?
31,What are the benefits of using charcoal or wood in tandoori cooking?
32,What are some examples of radiation cooking methods?
32,How does radiation cooking differ from traditional cooking methods?
32,Can you explain how microwaves cook food using radiation?
32,What are the benefits of using infrared grills in radiation cooking?
32,Is radiation cooking safe for all types of food?
33,What ingredients are needed to make a batter?
33,How does batter contribute to the texture of fried foods?
33,Can a batter be used for baking instead of frying?
33,What types of foods are commonly coated in batter before frying?
33,Are there variations of batter for different cuisines?
34,How does infra-red cooking differ from traditional methods?
34,What types of food are best suited for infra-red cooking?
34,What safety precautions should I take when using infra-red cooking?
34,Can I use infra-red cooking for baking or is it only for roasting?
34,What are the advantages of using infra-red cooking in my kitchen?
35,How does radiation cooking work in grilling?
35,What are the benefits of using microwaves for cooking?
35,Can you explain the difference between infrared waves and microwaves?
35,What types of foods are best suited for radiation cooking?
35,Is radiation cooking safe for all types of food?
36,What are the benefits of pressure cooking?
36,How does pressure cooking conserve fuel?
36,Does pressure cooking reduce nutrient loss compared to boiling?
36,Why is pressure cooking considered more efficient?
36,What makes pressure cooking require less attention?
37,What are the key steps for identifying hazards in food safety?
37,How do you determine critical control points in a meal preparation process?
37,What limits should be set for monitoring food safety?
37,How can I effectively document each step of the HACCP process?
37,What methods are used to verify the implementation of HACCP guidelines?
38,Can you explain what ingredients are typically used in a Navarin stew?
38,How long does it usually take to prepare and cook Navarin?
38,What sides pair well with a rich Navarin dish?
38,Are there variations of Navarin that use different meats?
38,What is the best method for serving Navarin to guests?
39,How is white meat prepared in a White Blanquette?
39,What type of stock is used for a White Blanquette?
39,Can vegetables be added to a White Blanquette stew?
39,What techniques are essential for making the sauce from the liquid?
39,Is there a specific type of meat recommended for White Blanquette?
40,How does a griddle differ from a frying pan in cooking methods?
40,What types of food are best suited for cooking on a griddle?
40,"Can I use a griddle for cooking meat, and if so, how?"
40,What temperature should I set my griddle for optimal cooking?
40,Are there specific maintenance tips for keeping a griddle in good condition?
41,What is the purpose of blanching in cooking?
41,How does blanching affect the texture of vegetables?
41,Can you explain the steps involved in blanching food?
41,Why is it important to cool foods quickly after blanching?
41,What types of foods benefit most from blanching?
42,What types of birds are classified as poultry?
42,How does the age of poultry affect its tenderness?
42,What cooking methods are best for different genders of poultry?
42,Can you explain how to choose the right type of poultry for a meal?
42,What domestic birds are most commonly used in cooking?
43,What are the benefits of over-heat grilling?
43,How do I know if my grill is pre-heated enough?
43,Can I use over-heat grilling for vegetables?
43,What factors affect the cooking time during over-heat grilling?
43,Do I need to oil the grill every time I cook?
44,What ingredients are needed for a soufflé to achieve an airy texture?
44,Can you explain the process of folding egg whites into the soufflé mixture?
44,What baking techniques help soufflés rise properly?
44,How important is the temperature of the egg whites for making a soufflé airy?
44,Are there any specific types of soufflés that are easier to make airy than others?
45,What is the principle behind grilling food?
45,How does grilling affect food flavor and texture?
45,What are the advantages of grilling over other cooking methods?
45,Can you explain how heat is applied in grilling?
45,What types of foods are best suited for grilling?
46,What is the purpose of paring fruits and vegetables?
46,How does paring improve the presentation of a meal?
46,Are there specific tools recommended for paring?
46,Can paring affect the taste of fruits and vegetables?
46,What are the main techniques used in paring?
47,What kind of meat is used in a Brown Ragoût?
47,How is the meat prepared before adding it to the Brown Ragoût?
47,Can you use white wine instead of red wine for a Brown Ragoût?
47,What is the purpose of frying the meat for a Brown Ragoût?
47,What type of liquid is typically used in a Brown Ragoût?
48,What ingredients are suitable for cooking en papillote?
48,How do you properly seal the packet for en papillote cooking?
48,What are the benefits of using en papillote cooking techniques?
48,Can you provide a recipe that uses the en papillote method?
48,What types of food can be cooked en papillote?
49,What temperature is ideal for baking shirred eggs?
49,How long should I bake shirred eggs for the best results?
49,What texture should shirred eggs have when done cooking?
49,Can I add ingredients to shirred eggs before baking them?
49,Is there a specific type of dish recommended for shirred eggs?
50,What is the best way to prepare fennel for cooking?
50,Can I cook fennel in the oven instead of boiling?
50,What doneness should I aim for when cooking fennel?
50,Are there any other cooking methods for fennel I should know about?
50,How can I tell when fennel is tender after cooking?
51,How does radiant heat affect the cooking process?
51,What is the role of a crust in roasting food?
51,Can roasting be done on a spit or only in an oven?
51,What are the taste benefits of roasting food?
51,Does roasting guarantee a moist interior for all types of food?
52,How does heat transfer through conduction work during cooking?
52,Can you give an example of conduction in a kitchen setting?
52,What types of cookware utilize conduction effectively?
52,How does the surface material of a pan affect conduction?
52,What are the benefits of using conduction for cooking food?
53,At what temperature does the Maillard reaction start?
53,What types of foods experience the Maillard reaction?
53,What chemical components are involved in the Maillard reaction?
53,How does the Maillard reaction affect flavor in cooking?
53,Can the Maillard reaction be used in baking?
54,Can you explain how the Maillard reaction affects the flavor of grilled steaks?
54,What types of foods benefit from the Maillard reaction during cooking?
54,At what temperatures does the Maillard reaction typically occur?
54,How does the Maillard reaction contribute to the browning of baked goods?
54,Are there specific methods to enhance the Maillard reaction when cooking?
55,What is the main method used in spit roasting?
55,How does spit roasting affect the flavor of meat?
55,What types of meat are best suited for spit roasting?
55,Can you explain the cooking process involved in spit roasting?
55,Are there specific tools needed for spit roasting?
56,What is the first step in preparing a basic omelet?
56,What temperature should the skillet be for cooking an omelet?
56,Can I add ingredients to an omelet before it sets?
56,How do I know when the omelet is ready to fold or roll?
56,What types of fillings can I use in a basic omelet?
57,What does HACCP stand for in cooking safety?
57,How can I implement HACCP in my kitchen?
57,What are the key principles of HACCP?
57,Why is it important to be proactive in food safety?
57,Can you provide examples of hazards HACCP helps prevent?
58,How can I tell if the fish is fresh before I buy it?
58,What should the eyes of fresh fish look like?
58,Is it normal for fish to have a strong smell?
58,What texture should I expect from the flesh of fresh fish?
58,Why is it important to check the scales of fish?
59,What benefits come from slicing vegetables evenly?
59,How does uniform slicing affect cooking time?
59,Why is texture consistency important in dishes?
59,In what types of meals is presentation crucial?
59,Can unevenly sliced vegetables impact the flavor of a dish?
60,What mechanism does a microwave use to heat food?
60,Why doesn't food brown when cooked in a microwave?
60,How does microwave cooking compare to traditional methods?
60,Can microwaves be used for all types of food?
60,What are the benefits of using a microwave for cooking?
61,What are the main benefits of using a microwave for cooking?
61,Can you explain the process of how microwaves heat food?
61,What types of meals are best suited for microwave cooking?
61,Is microwave cooking safe for all types of food?
61,How does reheating food in a microwave differ from traditional methods?
62,What is caul fat and how is it prepared for cooking?
62,What types of dishes can I make using caul fat?
62,Can caul fat be substituted with anything else in recipes?
62,How does caul fat affect the flavor and texture of a dish?
62,Is there a specific cooking technique required when using caul fat?
63,What is the best way to keep eggs fresh at home?
63,Should I wash eggs before storing them?
63,How can I prevent eggs from absorbing odors?
63,What should I do with older eggs?
63,Is it necessary to refrigerate eggs for storage?
64,What temperatures are ideal for deep-frying meats?
64,Are there specific meats that are typically deep-fried?
64,What is the breading process for deep-fried meat dishes?
64,Can you explain how to maintain moisture in deep-fried meats?
64,Is chicken-fried steak a popular dish for deep-frying?
65,How does aging meat improve its tenderness?
65,What flavor benefits come from aging meat?
65,Why are veal and pork not commonly aged?
65,What role does marinating play for tough cuts of meat?
65,What conditions are ideal for aging meat effectively?
66,What health benefits does steaming provide for vegetables?
66,Why is steaming considered a gentle cooking method?
66,Which types of foods are best suited for steaming?
66,How does steaming affect the nutrients in food?
66,Can you explain the process of steaming food?
67,How do I make seasoned flour for my recipes?
67,What types of food can I coat with seasoned flour?
67,Why would I use seasoned flour instead of regular flour?
67,Can I add other spices to seasoned flour for more flavor?
67,Is seasoned flour suitable for baking or just frying?
68,How does sous vide ensure even cooking?
68,What types of food are best suited for sous vide?
68,What equipment do I need for sous vide cooking?
68,How do I prepare the food for sous vide?
68,What are the benefits of using sous vide over traditional cooking methods?
69,What is the purpose of pressing vegetables before cooking?
69,How does pressing affect the texture of grated vegetables?
69,What type of dishes benefit from drier vegetable consistency?
69,Can you explain the process of pressing vegetables?
69,Are there specific vegetables that should always be pressed before cooking?
70,What is the best way to sauté mushrooms?
70,How long should I roast mushrooms for optimal tenderness?
70,What type of butter works best for cooking mushrooms?
70,Can I cook mushrooms without butter?
70,Are there any seasoning tips for sautéed mushrooms?
71,What vegetables are typically used in ratatouille?
71,Can ratatouille be made in advance for meal prep?
71,How should I serve ratatouille as a main dish?
71,What is the cooking process for making ratatouille?
71,Are there any variations of ratatouille I can try?
72,How does skimming affect the clarity of stocks?
72,Why is removing foam important in sauce preparation?
72,What technique helps improve flavor in simmering liquids?
72,Can skimming be applied to both stocks and sauces?
72,What are the benefits of skimming during cooking?
73,Can you explain the process of blanching for vegetables?
73,What are the benefits of using blanching in cooking?
73,How does blanching help maintain color in foods?
73,What types of foods are best suited for blanching?
73,Is there a specific time for blanching different vegetables?
74,What is the best way to soak vegetables?
74,How long should I soak vegetables to remove dirt?
74,Can soaking vegetables affect their nutritional value?
74,Are there specific vegetables that require soaking?
74,What are the alternatives to soaking vegetables for cleaning?
75,What are the benefits of steaming compared to boiling?
75,How does steaming help retain flavor in food?
75,Can steaming shorten cooking times for vegetables?
75,Why is it important to preserve nutrients when cooking?
75,Are there specific foods that are better suited for steaming?
76,What temperature should I set the air fryer for corn on the cob?
76,How long do I need to cook corn on the cob in an air fryer?
76,Is there any special preparation needed for air frying corn on the cob?
76,Can I season corn on the cob before air frying it?
76,What type of corn is best for air frying?
77,What temperature should I set for grilling lamb chops?
77,How long do I need to grill ¾-inch lamb chops?
77,How often should I turn the lamb chops while grilling?
77,Is there a specific cooking time for different thicknesses of lamb chops?
77,What should I do if the grill temperature is lower than 500°F?
78,What does it mean to marinate meat before braising?
78,Can you explain the importance of browning meat in the braising process?
78,What types of root vegetables are best for brown braising?
78,"What liquid is typically used for brown braising, and why?"
78,How long should I cook the meat in the oven when braising?
79,What is the temperature used in tandoori cooking?
79,What kind of oven is used for tandoori cooking?
79,How does tandoori cooking enhance the flavor of food?
79,What types of food can be cooked in a tandoor?
79,What is the cooking technique used in tandoori?
80,What are critical limits in food safety?
80,How do I determine critical limits for cooking?
80,Can you give examples of critical limits in cooking?
80,Why are critical limits important in HACCP?
80,What happens if critical limits are not met?
81,What are biological hazards in food preparation?
81,Can you explain physical hazards that occur in cooking?
81,What cleaning agents are considered chemical hazards?
81,How can allergens pose risks in meal preparation?
81,What measures can I take to prevent food hazards?
82,What steps are involved in preparing meat for brown braising?
82,Which types of root vegetables are best for brown braising?
82,What liquids and flavorings should I add when brown braising?
82,How long should I cook the meat in the oven for brown braising?
82,"Can I use different meats for brown braising, and how does it affect the cooking process?"
83,What is the process of between-the-heat grilling in detail?
83,How does between-the-heat grilling affect the cooking of small meat cuts?
83,What equipment is needed for between-the-heat grilling?
83,Are there specific types of meat best suited for between-the-heat grilling?
83,What are the advantages of using between-the-heat grilling over traditional methods?
84,What is the role of emulsification in sauces?
84,How can I achieve a stable emulsion when making dressings?
84,What ingredients can I use for emulsification in cooking?
84,Are there any common mistakes to avoid when emulsifying liquids?
84,Can you explain how emulsification affects texture and flavor in dishes?
85,Can you explain what veal is in detail?
85,What age are calves when they are used for veal?
85,Why is veal considered to be tender meat?
85,How does the diet of the calves affect veal's tenderness?
85,What is the difference between free-range veal and regular veal?
86,What is the purpose of using filtration in stock preparation?
86,How does filtration improve the texture of sauces?
86,Can you explain the benefits of clarifying broths through filtration?
86,What types of cooking tasks commonly involve filtration?
86,How does the process of filtration affect the final dish?
87,What happens to fish if it is cooked for too long?
87,How does retained heat affect fish after it's taken off the stove?
87,Why is timing important when cooking fish?
87,What are the consequences of dry fish when overcooked?
87,How can I avoid losing flavor in cooked fish?
88,What ingredients are best for stir-frying?
88,How do I prepare meat for stir-frying?
88,What type of oil should I use for stir-frying?
88,Can I stir-fry frozen vegetables?
88,How do I know when my stir-fry is done?
89,What temperature should the water be when poaching eggs?
89,Why is vinegar added to the water for poaching eggs?
89,How long should I cook poached eggs for the best results?
89,What is the difference between Grade AA and other egg grades for poaching?
