id,question
502,Are there any tips for grilling a whole chicken evenly?
502,How can I tell when the chicken is fully cooked?
503,What are the key characteristics to look for when selecting liver?
503,How should kidneys appear to ensure freshness?
503,What does a creamy-white appearance indicate for sweetbreads?
503,What signs indicate that tongue is of good quality?
503,How can I tell if oxtails are fresh?
504,What method should I use to keep green veggies colorful while cooking?
504,How can I ensure my green vegetables are tender-crisp?
504,Is there a specific cooking time for vibrant green vegetables?
504,What is the benefit of cooking small batches of vegetables?
504,Why is it important to cook green vegetables uncovered?
505,What is the safe temperature for storing ready-to-eat foods?
505,How should I label ready-to-eat foods for safety?
505,What are the time limits for using ready-to-eat foods?
505,Why is it important to maintain cold holding temperatures?
505,What happens if ready-to-eat foods are above 41F?
506,What is the purpose of adding pig's feet to stews?
506,How does gelatin from feet affect the texture of soup?
506,Can you explain the benefits of using calf's feet in cooking?
506,Why does gelatin cause soups to solidify when chilled?
506,What are the culinary uses of gelatin-rich ingredients like feet?
507,What temperature should I set the grill for cooking chicken drumsticks?
507,How often should I turn the chicken while grilling?
507,How long does it take to grill chicken thighs and leg quarters?
507,Can I use a different cooking method for these chicken parts?
507,Do I need to season the chicken before grilling it?
508,What is the best method to carve cooked meat for tenderness?
508,How can I identify the muscle fiber direction in meat?
508,Why is it important to slice across the grain of meat?
508,What should I do if the muscle grain changes while carving?
508,Are there any tips to improve the tenderness of carved meat?
509,Can you explain how convection works in an oven?
509,What are some advantages of using convection for cooking?
509,In what other cooking methods can convection be found?
509,How does convection affect cooking times and temperatures?
509,Are there specific foods that cook better with convection?
510,What technique should I use to break down the collagen in oxtails?
510,How long should I simmer oxtails for optimal tenderness?
510,What steps are necessary to prepare tripe before cooking?
510,Why is blanching important for tripe preparation?
510,What consistency should tripe have when it's fully cooked?
511,What temperature should I set the grill for medium beef kabobs?
511,How long do I need to grill beef kabobs for medium doneness?
511,What is the internal temperature for medium beef kabobs?
511,Should I let beef kabobs rest before serving them?
511,What grilling method is best for cooking beef kabobs?
512,What is the typical age range for young swine used for pork?
512,How is pork commonly processed after slaughter?
512,What percentage of pork is sold fresh compared to processed?
512,What are the common products made from cured pork?
512,Why is curing pork an important processing method?
513,What are the ingredients needed to make a chocolate hummus dip?
513,How do I blend the ingredients for the sweet dip smoothly?
513,Can I substitute any ingredient in the chocolate hummus recipe?
513,What is aquafaba and how does it work in this recipe?
513,How can I make the chocolate hummus dip more flavorful?
514,What is the cooking time for Pork Baby Back Ribs at 325°F using indirect heat?
514,How should I cook Pork Baby Back Ribs at 325°F for best results?
514,How often should I turn Pork Baby Back Ribs while cooking indirectly at 325°F?
514,What temperature is recommended for cooking Pork Baby Back Ribs indirectly?
514,Can you provide cooking tips for Pork Baby Back Ribs at 325°F?
515,What temperature should I grill a 3/4-inch hamburger patty?
515,How often do I need to turn the hamburger patty while grilling?
515,What is the total grilling time for a 3/4-inch hamburger patty at high heat?
515,Can I grill thicker hamburger patties the same way?
515,What adjustments should I make for grilling multiple patties at once?
516,What temperature should I aim for with my food thermometer when grilling meats?
516,How do I monitor my grill's heat levels effectively?
516,Can you explain how cooking times vary for different types of grills?
516,Why is it important to let grilled meats rest before slicing?
516,What are some techniques to keep meats juicy while cooking?
517,What method should I use to cook cabbage-family vegetables to minimize odors?
517,How long should I cook cabbage-family vegetables to prevent strong smells?
517,Is it necessary to cook cabbage-family vegetables covered or uncovered?
517,What should I add to cabbage-family vegetables to keep their color and crispness?
517,Does the amount of water used affect the odor when cooking cabbage-family vegetables?
518,What ingredients are needed for a tzatziki dip?
518,How do I prepare the grated cucumber for tzatziki?
518,Can I use regular yogurt instead of Greek yogurt in tzatziki?
518,What is the best way to serve tzatziki with pita bread?
518,How long can tzatziki dip be stored in the refrigerator?
519,What steps should I take to wash vegetables properly?
519,How can I ensure my cutting boards are safe for vegetable prep?
519,What are the best practices for storing vegetables in the refrigerator?
519,How do I know when vegetables have gone bad?
519,What should I do if I think my vegetables are contaminated?
520,What is the best timing for steaming fresh broccoli?
520,How do I adjust steaming time for frozen broccoli?
520,What factors should I consider when steaming broccoli size?
520,Can I steam broccoli without affecting its color?
520,What technique preserves the texture of steamed broccoli?
521,What ingredients do I need for French Onion Dip?
521,How can I use Greek yogurt in a savory dip?
521,Can Worcestershire sauce be substituted in this recipe?
521,What vegetables pair well with French Onion Dip?
521,How do I adjust the recipe for a lower calorie dip?
522,What are some scalable seasoning blends I can use for a large event?
522,How do I maintain flavor when increasing the volume of spices?
522,Can you suggest specific spice ratios for American and Cajun blends?
522,What ingredients should I consider for a Mexican spice mixture?
522,Are there any tips for balancing flavors in large quantities of spice mixtures?
523,What charts should I refer to for seasoning blends when cooking in bulk?
523,How can I ensure accurate measurements for large batch cooking?
523,What methods help maintain flavor quality during mass preparation?
523,How do I adjust cooking times for larger quantities without compromising taste?
523,What are the best practices for achieving consistent flavor results in big meals?
524,What temperature should I set my grill to for filet mignon?
524,How long do I need to grill filet mignon for medium doneness?
524,What internal temperature indicates that my filet mignon is medium?
524,"Should I rest the filet mignon after grilling, and for how long?"
524,What is the ideal temperature range for grilling a filet mignon?
525,How long should I boil French beans to keep them crispy?
525,What method should I use to shock French beans after cooking?
525,Why is it important to stop the cooking process for French beans?
525,Can I use the same technique for other vegetables?
525,What happens to French beans if I don't shock them in cold water?
526,How long should I air fry 20 oz of thin-cut fries?
526,What temperature is best for air frying thin-cut french fries?
526,Can I cook thin-cut french fries at a lower temperature?
526,What is the process to ensure crispy thin-cut fries in an air fryer?
526,Are there any tips for making thin-cut fries in an air fryer?
527,What strategies can I use to make vegetable dishes appealing to kids?
527,How can I get kids to help choose new vegetables for meals?
527,What are some fun ways to involve children in naming new dishes?
527,How can I encourage kids to participate in menu planning?
527,What kind of positive language works best to promote vegetable dishes to children?
528,What is the steaming time for whole artichokes?
528,How long should I steam broccoli florets?
528,What is the recommended time for steaming whole asparagus spears?
528,How long do I need to steam whole beetroot?
528,Is there a big difference in steaming times for different vegetables?
529,What ingredients are needed for the chocolate chip cookie dip?
529,How do I prepare the nutritious dip for fruit and pretzels?
529,Can I substitute any ingredients in the dip recipe?
529,Is this dip suitable for people with nut allergies?
529,What other fruits or snacks can I serve with the dip?
530,What are the key characteristics of dry-heat cooking methods?
530,Can you list some techniques that fall under dry-heat cooking?
530,How does dry-heat cooking contribute to flavors in a dish?
530,What types of textures can I expect from dry-heat cooking methods?
530,Why is moisture not added in dry-heat cooking techniques?
531,What temperature should I preheat the grill for a New York strip steak?
531,How long should I grill a New York strip steak for medium doneness?
531,What is the target internal temperature for medium steak?
531,Is it necessary to let the steak rest after grilling?
531,What is the best way to preserve the juices in a grilled steak?
532,What temperature should I grill a Rib Eye Steak for best results?
532,How long should I grill a 1¼-inch Rib Eye Steak?
532,Is it necessary to turn the Rib Eye Steak while grilling?
532,What is the ideal thickness for a Rib Eye Steak to grill perfectly?
532,How can I ensure my Rib Eye Steak is cooked to the right level of doneness?
533,What is pressure steaming and how does it affect veggies?
533,Why is baking considered better for nutrient retention than boiling?
533,How does vigorous boiling impact the nutrients in vegetables?
533,Which cooking methods provide the best flavor and texture for veggies?
533,Are there specific vegetables that retain more nutrients with certain cooking methods?
534,What acidic solutions can I use to prevent browning in cut potatoes?
534,How long can I soak cut eggplants in water before cooking?
534,Are there any antioxidants I can use besides lemon juice for browning prevention?
534,Does storing cut vegetables in water affect their texture?
534,Can I combine lemon juice with other ingredients to treat browning in vegetables?
535,Can you explain the process of coagulation in more detail?
535,What temperature is required to achieve coagulation in proteins?
535,In what other recipes besides custards and scrambled eggs is coagulation important?
535,How does coagulation affect the texture of cheese?
535,Are there any techniques to control coagulation while cooking?
536,What temperature should I cook a 5 lb chicken at?
536,How long do I need to cook an unstuffed whole chicken?
536,Is indirect cooking necessary for a whole chicken?
536,Can I cook a 5 lb chicken with stuffing?
536,What is the best way to check if the chicken is done?
537,What is the ideal internal temperature for different steak doneness levels?
537,How long should I let steaks rest before serving?
537,What tools can I use to check the internal temperature of my steaks?
537,"Is it necessary to let steaks rest after grilling, and why?"
537,What happens if I remove steaks from the grill too early or too late?
538,What is the ideal stir-frying time for sliced asparagus?
538,How long should I cook broccoli florets in a stir-fry?
538,Can I stir-fry both asparagus and broccoli together?
538,Are there any specific techniques for stir-frying vegetables like asparagus?
538,What other vegetables can I stir-fry alongside asparagus and broccoli?
539,What cooking methods best keep the color of yellow vegetables?
539,How do I cook orange vegetables while preserving their brightness?
539,What happens to vegetables if they are overcooked?
539,Why is it important to cook vegetables for a short time?
539,Are there specific techniques to enhance the color of cooked yellow veggies?
540,What temperature should I preheat the grill for a Porterhouse Steak?
540,How long should I cook a Porterhouse Steak on each side?
540,What is the total cooking time for a 1-inch Porterhouse Steak?
540,"Should I let the steak rest after grilling, and for how long?"
540,What other seasonings can I use for a Porterhouse Steak before grilling?
541,What are the effects of using a lot of water when boiling vegetables?
541,How does the amount of water impact nutrient retention in vegetables?
541,What happens to the color of vegetables when boiled in more water?
541,Why is it important to find a balance in water usage for boiling?
541,What are the potential risks of using too little water while cooking vegetables?
542,How does vegetable cell structure influence cooking methods?
542,What role does fiber play in the texture of vegetables?
542,Why is it important to know the acidity levels of vegetables while cooking?
542,How can understanding fiber content improve meal nutrition?
542,What techniques can enhance tenderness in vegetables without losing flavor?
543,What is the correct technique for shallow-frying fish with skin?
543,How long should I cook the fish skin-side down while shallow-frying?
543,What can I use to drain excess oil after frying fish?
543,Why is it important to cook fish skin-side down first?
543,What utensils are recommended for shallow-frying fish?
544,What should I look for when buying poultry to ensure quality?
544,How can I verify the freshness of poultry at the store?
544,What is the best way to store poultry after purchasing it?
544,What temperature should poultry be kept at during storage?
544,How long can I safely store poultry in the refrigerator?
545,What is the ideal steaming time for fresh spinach?
545,How long should I steam frozen spinach to maintain color?
545,What method should I use to preserve nutrients in spinach?
545,Does steaming spinach with water affect its nutrients?
545,Can you recommend a technique for brightening spinach color while cooking?
546,What are the key principles of HACCP in food safety?
546,How does HACCP prevent hazards during cooking?
546,What makes HACCP a proactive approach to food safety?
546,Can you explain the differences between HACCP and traditional safety methods?
546,How can I implement HACCP in my kitchen processes?
547,What is the grilling temperature range for shrimp?
547,How long should I grill salmon to reach the proper temperature?
547,What is the recommended time for grilling a tuna steak?
547,At what temperature should I grill a lobster tail?
547,How long do I need to grill a whole snapper to ensure it's cooked properly?
548,What pigments are responsible for the yellow and orange colors in vegetables?
548,How can I maintain the green color of leafy vegetables while cooking?
548,What cooking methods help to retain the color pigments in vegetables?
548,Why is it important to control pH when cooking vegetables?
548,Can you explain the role of flavonoids in vegetable coloration?
549,What temperature should cooked veggies be held at to stop spores from germinating?
549,How quickly must I cool cooked cereals to prevent spore growth?
549,Is it safe to keep cooked vegetables at 135 degrees Fahrenheit?
549,What is the maximum time allowed to cool foods to below 41 degrees Fahrenheit?
549,Why is it important to prevent spore germination in cooked foods?
550,What is the typical cooking technique for shellfish before additional preparation?
550,"Is boiling an appropriate method for cooking fish, and why?"
550,How does the cooking process for shellfish differ from that of fish?
550,What are the reasons for choosing poaching over boiling for fish?
550,Can you describe the steps involved in preparing shellfish after boiling?
551,What preparation techniques can staff use to enhance vegetable appeal?
551,How can flavor pairings influence students' vegetable choices?
551,What are some effective presentation methods for vegetables?
551,In what ways does staff enthusiasm affect student food choices?
551,How can training impact students' overall acceptance of healthy foods?
552,What temperature should I set my grill for bone-in chicken breast?
552,How can I tell if the chicken breast is fully cooked?
552,Is 45 minutes a standard grilling time for chicken breast?
552,What should I do if the chicken is not reaching 165°F?
552,Are there any tips for grilling chicken to keep it moist?
553,How many fillets can I get from flat fish compared to round fish?
553,What techniques can I use to fillet fish properly?
553,Does filleting round fish cause more waste than flat fish?
553,What are the benefits of filleting fish correctly?
553,Can you explain the filleting process for round and flat fish?
554,What are some healthy seasoning options I can include for diners to customize their meals?
554,How can I set up a flavor cart effectively in my kitchen?
554,What low-sodium spices should I provide for diners who want to personalize their meals?
554,How can diners be encouraged to experiment with flavors while maintaining health standards?
554,What types of herbs can enhance the taste of a meal without adding extra sodium?
555,What temperature should bakery products like custards reach for safety?
555,How long can pancake batter be left at room temperature before it must be discarded?
555,What is the cooldown temperature for custards and pastry creams after heating?
555,Are there specific time limits for cooling bakery products to ensure safety?
555,What should I do with pancake batter that has been out for 4 hours?
556,What is the ideal grilling temperature for beef burgers?
556,How many minutes do I need to grill beef burgers for medium doneness?
556,At what internal temperature should beef burgers be cooked for medium doneness?
556,"Should I let beef burgers rest after grilling, and if so, for how long?"
556,What are the signs that beef burgers are cooked to medium doneness?
557,What internal temperature should I aim for when grilling chicken thighs?
557,How long do I grill bone-in chicken thighs for optimal results?
557,What temperature is best for grilling chicken thighs on the bone?
557,Can you explain the grilling process for bone-in chicken thighs?
557,How can I check if my chicken thighs are fully cooked while grilling?
558,What are the best materials to rewrap meat after two days?
558,Why is it important to prevent moisture accumulation in meat?
558,How can controlled-atmosphere packaging benefit meat storage?
558,What happens if meat is left in standard packaging for too long?
558,Can I store meat in plastic wrap indefinitely after unwrapping?
559,What changes can improve the cafeteria setting for vegetable consumption?
559,How can I extend meal times to promote vegetable tasting?
559,What schedule adjustments can encourage students to try more vegetables?
559,What environmental factors influence vegetable enjoyment among students?
559,Are there specific strategies to make vegetables more appealing during lunch?
560,What is the recommended internal temperature for pork ribs?
560,At what temperature should ham be cooked when raw?
560,How should brisket be cooked for ideal doneness?
560,What is the safe internal temperature for lamb steaks and chops?
560,What internal temperature is required for ground veal?
561,What are some alternatives if I lack calf's foot for my dish?
561,Can you suggest a substitute for calf's foot in cooking?
561,How can I replace calf's foot when preparing a recipe?
561,What can I use instead of calf's foot to achieve gelatin in my meal?
561,Is there a different ingredient to use if calf's foot is not available?
562,What are some examples of appealing names for vegetable dishes aimed at kids?
562,How does naming affect a child's willingness to try new foods?
562,Can you suggest creative names for a broccoli dish to attract children?
562,What strategies can I use besides naming to make vegetables more appealing to kids?
562,Are there specific adjectives that work best in naming vegetable dishes for children?
563,What is the process of sugar browning in cooking?
563,How does caramelization influence the taste of sautéed vegetables?
563,Can you describe the role of caramelization in baking bread?
563,What types of foods benefit from caramelized flavors during cooking?
563,Why is caramelization important for developing complex flavors in dishes?
564,What internal temperature should I aim for if I want my beef cooked medium-rare?
564,How hot should ground beef be cooked to for safety?
564,"If I prefer my steak rare, what should the internal temperature be?"
564,What temperature is ideal for brisket when it's done cooking?
564,Can you list the internal temperatures required for each level of beef doneness?
565,What temperature should I grill skinless chicken legs?
565,How many times should I turn chicken thighs while grilling?
565,Is 24 minutes sufficient for cooking chicken drumsticks?
565,Can I use a different method for grilling chicken legs?
565,What part of the chicken are thighs considered?
566,What is the safe cooking temperature for fish?
566,How long should I hold cooked shellfish at a safe temperature?
566,What happens if fish is not cooked to 63 degrees?
566,Why is it important to serve fish immediately after cooking?
566,How can I prevent dryness when cooking fish to order?
567,What are some active strategies to get kids to eat more veggies?
567,How can cooking demonstrations help improve children's vegetable intake?
567,Are taste tests effective for encouraging kids to try new vegetables?
567,What types of interactive nutrition events can be organized for children?
567,Why are passive methods like posters less effective for promoting vegetable consumption?
568,What is the ideal boiling time for frozen vegetables to keep their color?
568,How can I best maintain the flavor of boiled frozen peas and carrots?
568,What is the recommended cooking method for frozen peas and carrots for large servings?
568,At what temperature should I boil frozen peas and carrots?
568,What can I do to ensure even cooking for 100 servings of frozen vegetables?
569,What are the best pairings for lovage in a dish?
569,Can you suggest some vegetables that go well with lovage?
569,Is it better to use lovage fresh or cooked?
569,What flavor profile does lovage add to chicken dishes?
569,How can I incorporate lovage with fish or mussels?
570,What ingredients can be found in pralines?
570,How do pralines differ from other chocolates?
570,What happens to pralines if invertase is used?
570,"Can pralines have liquid centers, and how does that occur?"
570,Are nuts or fruit pastes more common in pralines?
571,How do you roast figs for making fig coffee?
571,What flavors does fig coffee enhance when blended?
571,Can fig coffee be used as a substitute for regular coffee?
571,What is the texture of the product obtained from fig coffee?
571,Are there any specific brewing methods for fig coffee?
572,How is yellow tea processed during production?
572,What distinguishes yellow tea from green and black teas?
572,What changes occur to tannins in yellow tea?
572,How does the oxidation process affect yellow tea's flavor?
572,What color are the leaves of yellow tea compared to other teas?
573,What fruits pair well with mangoes?
573,Which spices complement mangoes in dishes?
573,How can I use creamy elements with mangoes?
573,Are there specific citrus fruits that enhance mango flavors?
573,What combinations provide a balanced taste with mangoes?
574,Can you explain how malt coffee is prepared?
574,What are the main ingredients in malt coffee?
574,What flavor characteristics does malt coffee have?
574,How does roasting affect the taste of malt coffee?
574,Is malt coffee suitable for those avoiding caffeine?
575,How is acorn coffee made?
575,What does acorn coffee taste like?
575,Can acorn coffee be mixed with other beverages?
575,What are the benefits of drinking acorn coffee?
575,Are there any specific types of acorns used for this coffee?
576,What cooking methods are best for veal loin?
576,Which herbs and spices pair well with veal loin?
576,What are some ideal side dishes for a veal loin meal?
576,Can you suggest sauces that complement veal loin?
576,What vegetables should I consider when cooking veal loin?
577,What cooking methods can I use for mahi mahi?
577,Which ingredients enhance the flavor of mahi mahi?
577,Is mahi mahi suitable for grilling or baking?
577,Can you suggest sides that pair well with mahi mahi?
577,How can I prepare mahi mahi to keep it moist?
578,What are the best cooking methods for carrots?
578,Which flavors pair well with carrots?
578,Can you recommend some cooking techniques for carrots?
578,What ingredients enhance the taste of cooked carrots?
578,How do I prepare carrots using different cooking styles?
579,What cooking methods can I use for turnips?
579,Which ingredients work well with turnips?
579,Is boiling turnips a good cooking option?
579,Can I enhance turnip flavor with bacon?
579,What herbs complement turnips in a dish?
580,What are some cooking methods for eggplant?
580,Which ingredients pair well with eggplant?
580,"Can I stuff eggplant, and how?"
580,What temperature should I use to roast eggplant?
580,Are there specific seasonings that enhance eggplant dishes?
581,What are the different cooking methods for trout?
581,What ingredients go well with trout?
581,Can trout be prepared using a grilling method?
581,Are there specific flavor pairings for trout dishes?
581,What is the best way to cook trout for maximum flavor?
582,What ingredients go well with burrata?
582,Can burrata be served with fruits?
582,What are some Italian dishes that feature burrata?
582,How should I prepare fava beans to serve with burrata?
582,Is vincotto essential when serving burrata?
