id,question
674,What are some cooking methods for using lychees effectively?
675,What vegetables go well with Swiss cheese?
675,Which fruits can I use to complement Swiss cheese?
675,What type of bread should I use with Swiss cheese?
675,Can Swiss cheese be paired with different meats?
675,How can I incorporate Swiss cheese into a fondue?
676,What nuts go well with blue cheeses?
676,Which type of bread complements blue cheeses?
676,What type of wine is a good match for blue cheeses?
676,Can you suggest a sweetener that pairs with blue cheeses?
676,Are there any fruits that enhance the flavor of blue cheeses?
677,What are the main ingredients in traditional Austrian dishes?
677,Can you describe some comfort foods in Austrian cuisine?
677,Which herbs and spices are commonly used in Austrian cooking?
677,What types of pastries are popular in Austria?
677,How important are meats like beef and pork in Austrian recipes?
678,How do I determine the intensity of different flavors?
678,What are examples of mild and strong flavors?
678,How can I balance flavor intensity in my dish?
678,What should I consider when adjusting herb amounts?
678,Can flavor intensity affect the overall taste of a meal?
679,How can I use hazelnut oil in salads?
679,What are some desserts that pair well with hazelnut oil?
679,Is hazelnut oil suitable for cooking or just finishing dishes?
679,Can I substitute hazelnut oil for other oils in savory recipes?
679,What flavor profile does hazelnut oil add to meals?
680,How can sambal oelek enhance my rice dishes?
680,What spices can I add to sambal oelek for more flavor?
680,Is sambal oelek suitable for seasoning other types of dishes?
680,What is the main ingredient in sambal oelek?
680,Can I make sambal oelek at home or should I buy it?
681,Which herbs complement kohlrabi in a dish?
681,Can you suggest a cheese that goes well with kohlrabi?
681,What spices can enhance the flavor of kohlrabi?
681,Are there any vegetables that pair nicely with kohlrabi?
681,What type of fat is recommended to use with kohlrabi?
682,What herbs complement salt cod in a dish?
682,Can you suggest a sauce to serve with salt cod?
682,What are some classic ingredients to use with salt cod?
682,How can I enhance the flavor of salt cod?
682,Which types of vinegar go well with salt cod?
683,What dishes benefit from kosher salt?
683,Why use kosher salt for brining?
683,How does kosher salt affect meat seasoning?
683,Can kosher salt be used in cocktails?
683,What makes kosher salt different from other salts?
684,What is the best time to incorporate allspice into a recipe?
684,How does adding allspice early affect the dish's flavor?
684,Should allspice be added at the beginning or the end of cooking?
684,What is the reason for adding allspice early in cooking?
684,Does adding allspice later change its flavor profile?
685,What is the process of cacao bean fermentation?
685,How long does cacao bean fermentation typically last?
685,What effects does fermentation have on the flavor of cacao beans?
685,Why is it important to remove the pulpy coating during fermentation?
685,How does fermentation improve the overall quality of cacao beans?
686,What citrus can enhance duck dishes?
686,How does cooked fennel influence duck recipes?
686,What role does star anise play in duck preparations?
686,Can you suggest a puree for duck that adds bitterness?
686,What are some ways to incorporate Seville oranges in duck dishes?
687,What dishes pair well with Chardonnay?
687,How can I use Chardonnay in a sauce?
687,Is Chardonnay suitable for cooking seafood?
687,Can Chardonnay enhance the flavor of chicken dishes?
687,What are good cooking techniques for using Chardonnay?
688,What is the best way to prepare fava beans for eating raw?
688,Which cheese pairs well with raw fava beans?
688,"Should I dress raw fava beans with oil, and if so, what type?"
688,How can I enhance the flavor of raw fava beans without overpowering them?
688,Are there any other ingredients that complement raw fava beans?
689,What meats work best with Valdeon cheese?
689,Can I pair Valdeon cheese with steak dishes?
689,What flavors complement Valdeon cheese?
689,How should I serve Valdeon cheese with charcuterie?
689,What wines go well with Valdeon cheese?
690,What fruits go well with ricotta cheese?
690,Can I use ricotta cheese instead of butter in any recipes?
690,What types of nuts complement ricotta cheese in dishes?
690,How can I incorporate ricotta cheese into pasta dishes?
690,What are some savory pairings for ricotta cheese besides prosciutto?
691,What dishes can I enhance with basil's freshness?
691,How can I store basil for off-season use?
691,What are some ways to incorporate basil into heavy meals?
691,Is there a specific time during cooking to add basil?
691,Can I use dried basil for year-round cooking?
692,What ingredients work well with ice wine vinegar?
692,Can I use ice wine vinegar in salad dressings?
692,What seafood dishes can I enhance with ice wine vinegar?
692,Are there specific fruits that pair nicely with ice wine vinegar?
692,How does ice wine vinegar affect the flavor of sauces?
693,What factors affect the aroma of different spices?
693,How does cultivation influence a spice's scent?
693,Why do spices have varying aroma profiles?
693,In what ways do genetics play a role in spice aroma?
693,Can the variety of a spice change its aroma characteristics?
694,What ingredients pair well with apples for a savory dish?
694,How do I create a savory-sweet side dish with apples?
694,Can you suggest a recipe that includes apples and red cabbage?
694,What spices enhance the flavor of apples in a savory context?
694,How can I achieve a balance of fruit and savory flavors in a dish?
695,What details do ingredient charts provide for meal planning?
695,How do flavor profiles influence ingredient choices?
695,Can I find seasonal ingredients in the chart?
695,What techniques are mentioned in the ingredient listings?
695,How can ingredient weight and volume affect my cooking?
696,What ingredients do I need for preserved lemons?
696,How long should I store preserved lemons in the refrigerator?
696,Can I use other spices besides cinnamon and clove for preserved lemons?
696,What is the purpose of salting the lemons in this recipe?
696,How do I enhance the flavor of preserved lemons during the aging process?
697,What dessert can I make with shiso and apples?
697,How can I enhance apple flavor using shiso?
697,Can shiso complement any specific apple varieties?
697,What is the effect of adding shiso to apple sorbet?
697,Are there other herbs that pair well with apple like shiso?
698,What warming spices should I use for winter cooking?
698,How do I incorporate hearty grains into my winter meals?
698,What are effective cooking methods for winter dishes?
698,Can you suggest comforting meal ideas for cold weather?
698,What role do roasting and stewing play in winter cooking?
699,What ingredients are needed to make chicory coffee?
699,Can you explain the roasting process for chicory roots?
699,What flavors can be enhanced in chicory coffee?
699,How does chicory coffee compare to regular coffee in taste?
699,Are there any health benefits associated with chicory coffee?
700,What are the best cooking methods for top round beef?
700,Can top round be used for dishes other than roast beef?
700,How should I prepare top round for sandwiches?
700,Is top round suitable for slow cooking or braising?
700,What flavors pair well with top round beef dishes?
701,What cooking method should I use for wild rice to make it tender?
701,Which ingredients complement the flavor of wild rice the best?
701,Can you suggest some dishes that pair well with wild rice?
701,Is there a specific way to season wild rice for game dishes?
701,How long does it typically take to simmer wild rice until it's done?
702,What types of dishes can I use Maldon salt with?
702,Why is Maldon salt considered a finishing salt for seafood?
702,Can I use Maldon salt on cooked dishes as well?
702,How does the texture of Maldon salt affect the flavor?
702,Is there a specific way to apply Maldon salt to raw fish?
703,What kind of eggs enhance pasta taste?
703,How do white truffles complement pasta?
703,What ingredients work well with rich pasta?
703,How can I achieve golden noodles?
703,What makes a pasta dough flavorful?
704,What types of ham go well with Comte cheese?
704,Can I use Comte cheese in a salad? How?
704,What is the best way to use hazelnut oil with Comte?
704,Are there specific salad greens that pair best with Comte?
704,What dishes can I make using Comte cheese and ham?
705,What are the key characteristics of Cantonese dishes?
705,How does Cantonese cuisine preserve natural flavors?
705,What cooking methods are commonly used in Cantonese recipes?
705,What role do aromatics play in Cantonese cooking?
705,Can you explain the importance of freshness in Cantonese cuisine?
706,What types of nuts can I use with honey?
706,Which fruits complement honey the best?
706,How can I incorporate honey with dairy products?
706,What flavor profile does honey add to meals?
706,Are there specific dishes where honey pairs well with nuts and fruits?
707,What are some dishes that pair well with kumquats?
707,Can kumquats be used in savory recipes with meats?
707,Which fruits work well with kumquats in desserts?
707,How can I incorporate kumquats into a fish dish?
707,What ingredients enhance the flavor of kumquats in a salad?
708,What ingredients enhance the taste of coffee?
708,Can you suggest pairings that go well with coffee?
708,Which flavors add richness to coffee-based desserts?
708,What type of cream works best with coffee?
708,How can I incorporate bourbon with coffee in recipes?
709,What herbs work well with melon dishes?
709,Which fruits can enhance the taste of melons?
709,How can I balance sweet melon with savory ingredients?
709,What tangy elements should I consider when serving melon?
709,Can you suggest savory pairings for melon appetizers?
710,What types of fish complement sake the best?
710,"Can I use sake in cocktails, and if so, how?"
710,Are there specific salads that go well with sake?
710,What is the effect of citrus on sake flavor pairing?
710,How can I enhance the flavor of sashimi with sake?
711,In what types of dishes is palm sugar best used?
711,Why shouldn't I use palm sugar in lighter dishes?
711,What cuisines commonly utilize palm sugar?
711,Can you give examples of desserts that work well with palm sugar?
711,How does palm sugar impact the flavor profile of curries?
712,What types of dishes benefit from fleur de sel?
712,How should I apply fleur de sel for best results?
712,Can I use fleur de sel on any meat preparation?
712,Is fleur de sel suitable for hot meals as well?
712,What is the texture of fleur de sel when used on food?
713,What are the best dishes to pair with malt vinegar?
713,Can I use malt vinegar in a marinade for meats?
713,How does malt vinegar affect the taste of dressings?
713,Is it appropriate to use malt vinegar in seafood recipes?
713,What should I avoid when using malt vinegar in cooking?
714,What flavors does cilantro bring to figs?
714,How can I use cilantro and figs together in a dish?
714,In what types of meals does cilantro complement figs well?
714,Can I include cilantro and figs in a salad recipe?
714,What is the best way to combine cilantro and figs in a dressing?
715,What fruits go well with Garrotxa cheese?
715,How does Garrotxa cheese taste when paired with figs?
715,What is a good way to serve Garrotxa cheese?
715,Can you suggest other pairings for Garrotxa cheese?
715,What characteristics of Garrotxa cheese enhance its flavor?
716,What fats can enhance chicken recipes?
716,Which spices are best for enriching chicken flavor?
716,How can cream be used in chicken dishes?
716,What nuts complement chicken meals well?
716,Can you suggest alternative oils for chicken cooking?
717,What methods can I use to reduce saltiness in my recipes?
717,Are there specific unsalted ingredients I can add to balance oversalted food?
717,How can I adjust seasoning in thicker purees without making them watery?
717,What should I do if I've added too much salt to a sauce?
717,Can I use volume increase techniques for other types of dishes affected by salt?
718,What are some ingredients that enhance the taste of mustard greens?
718,Can you suggest a combination for cooking mustard greens with bacon?
718,What cuisines utilize mustard greens for flavoring?
718,How can I incorporate soy sauce into my mustard greens dish?
718,What flavor pairings work best with mustard greens and sesame oil?
719,What are some examples of heavy main courses that I can pair with lighter desserts?
719,How can I manage my time effectively when preparing a menu?
719,What desserts can I prepare ahead of time for a meal featuring a last-minute cooked entrée?
719,How does balancing flavors in a menu improve the dining experience?
719,What factors should I consider when creating a balanced menu?
720,What are the best cooking methods for daikon?
720,Which flavors pair well with daikon?
720,"Can I eat daikon raw, and if so, how?"
720,How can I marinate daikon effectively?
720,What types of meat go well with daikon in dishes?
721,What are some fall dishes that include fennel?
721,How can I serve fennel with apples?
721,What are good summer pairings for fennel?
721,How does fennel pair with duck in summer recipes?
721,What flavors complement fennel when used seasonally?
722,What dishes are best made with rice wine vinegar?
722,How do I pair rice wine vinegar with other flavors?
722,Can rice wine vinegar be used in salad dressings?
722,What is the taste profile of rice wine vinegar?
722,Are there any substitutes for rice wine vinegar in recipes?
723,What are some Southeast Asian dishes that use fish sauce?
723,Can you suggest some dipping sauces that include fish sauce?
723,How does fish sauce enhance the flavor of spring rolls?
723,What ingredients pair well with fish sauce in cooking?
723,How can I incorporate fish sauce into my Thai recipes?
724,What process creates the aroma of saffron?
724,How do you maintain saffron's aroma during cooking?
724,What compounds are involved in saffron's unique scent?
724,Can you explain how safranal is formed?
724,Why is handling important for saffron's aroma?
725,What are some dishes where sesame oil works well?
725,Can you explain how to use sesame oil in a salad?
725,What ingredients pair best with sesame oil?
725,How does sesame oil enhance the flavor in marinades?
725,Is sesame oil suitable for cooking with chicken or beef?
726,What is the ideal brining time for chicken breast?
726,What ingredients are needed for the brine solution?
726,Should I rinse the chicken after brining?
726,How do I prepare the chicken before cooking after brining?
726,What effect does brining have on chicken texture?
727,What cooking methods can I use for shallots?
727,Which flavors pair well with shallots in recipes?
727,Can I use shallots in classic French sauces?
727,How do shallots compare in flavor to onions and garlic?
727,What are some tips for preparing shallots before cooking?
728,What cooking methods are best for flank steak?
728,Which bold flavors complement flank steak well?
728,How does marinating affect flank steak?
728,What spices should I use with flank steak?
728,Is grilling flank steak better than sautéing it?
729,What is the best way to use black truffles in my dish?
729,Which ingredients complement black truffles well?
729,How can I preserve the aroma of black truffles when cooking?
729,Are there specific dishes that go well with black truffles?
729,Should I prepare black truffles differently for various meals?
730,What fresh herbs pair well with mesclun greens?
730,How should I prepare the vinaigrette for mesclun greens?
730,What kind of toasted nuts work best with mesclun greens?
730,Can I add cheese to mesclun greens without masking the flavors?
730,What is the best way to serve mesclun greens as a salad?
731,What ingredients do I need for a mango sauce?
731,Can I use frozen mangoes to make the sauce?
731,What dishes pair well with a mango-based sauce?
731,How do I adjust the sweetness of my mango sauce?
731,What mild spices should I consider for flavoring the sauce?
732,What ingredients are essential in Vietnamese cooking?
732,How is fish sauce used in Vietnamese dishes?
732,Can you explain the role of herbs in Vietnamese cuisine?
732,What are common vegetables found in Vietnamese meals?
732,How does sweetened condensed milk contribute to Vietnamese flavors?
733,What fruits complement ginger in recipes?
733,How can I use ginger to enhance my dishes?
733,Which citrus fruits work well with ginger?
733,Are there desserts that benefit from ginger?
733,What savory dishes can I make with ginger?
734,How does mint affect the taste of chocolate desserts?
734,What flavor profile is created when combining mint and chocolate?
734,Can mint enhance the sweetness of chocolate dishes?
734,What are the key characteristics of mint when paired with chocolate?
734,"Is mint a common ingredient in chocolate recipes, and why?"
735,Which desserts work best with almond flavors?
735,What fruits can I use to enhance almond dishes?
735,Can you suggest a pairing of chocolate and almonds?
735,How does coffee complement the taste of almonds?
735,What are some good options for almond-based desserts?
736,Which spices enhance the taste of whiskey?
736,What fruits go well with whiskey?
736,How can I incorporate honey with whiskey in my dish?
736,What are some interesting ways to use cinnamon in whiskey recipes?
736,Can you suggest some desserts that pair with whiskey?
737,What types of meats pair well with sage?
737,Can you suggest vegetables that go well with sage?
737,How can sage be used in dishes with legumes?
737,Is sage a good addition to stuffings and sauces?
737,What ingredients work well with sage in slow-cooked meals?
738,What types of cheeses can I use to boost umami in my dishes?
738,Are there specific mushrooms that enhance umami flavor?
738,Which seafood options are high in umami content?
738,Can you suggest some fermented foods to incorporate for umami?
738,What dried ingredients can I add to my meal for umami richness?
739,Which root vegetables are best in winter meals?
739,What game meats can I use for a winter dish?
739,Are there specific citrus fruits that are great for winter recipes?
739,How do Brussels sprouts enhance winter flavors in dishes?
739,What winter greens should I incorporate into my meals?
740,What does Piave cheese taste like?
740,How can I use Piave cheese in a recipe?
740,Can Piave cheese be substituted for Cheddar?
740,What dishes are commonly made with Piave cheese?
740,Is Piave cheese used in traditional Italian cuisine?
741,What compound causes the strong flavor in black pepper?
741,How does light affect the pungency of black pepper?
741,What is the chemical responsible for the bite in black pepper?
741,Can piperine lose its intensity when exposed to light?
741,What happens to piperine when it converts to another isomer?
742,What cheeses complement fresh figs the best?
742,Can you suggest nuts that go well with fresh figs?
742,What sweeteners are suitable to pair with fresh figs?
742,Which herbs enhance the flavor of fresh figs?
742,Are there any specific dishes that use fresh figs effectively?
743,What fruits complement Muenster cheese?
743,Can you suggest bread options that go well with Muenster cheese?
743,What vegetables can be paired with Muenster cheese?
743,Are there any nuts that match well with Muenster cheese?
743,What are some desserts that can be served with Muenster cheese?
744,What ingredients complement Pecorino cheese in a dish?
744,Can you suggest fruits that go well with Pecorino cheese?
744,Which vegetables pair nicely with Pecorino cheese?
744,Are there any sauces that enhance the flavor of Pecorino cheese?
744,What types of meat work well with Pecorino cheese?
745,What is the best time to incorporate star anise into my cooking?
745,How does star anise enhance the flavor of dishes?
745,Can star anise be used in both savory and sweet recipes?
745,Are there specific dishes that benefit from adding star anise early in the cooking process?
745,Is there a technique for using star anise effectively in stews?
746,What are the benefits of using sea salt in cooking?
746,How does sea salt differ from table salt in flavor?
746,Are there any specific dishes that benefit from sea salt?
746,Why is mineral complexity important in gourmet cooking?
746,Can you explain how sea salt is produced?
747,What are some dishes that use mango and salmon together?
747,In what ways can mango enhance a dish featuring salmon?
747,Is mango suitable for a salmon sashimi dish?
747,How does the preparation method affect mango's compatibility with salmon?
747,What other ingredients should I consider when pairing mango with salmon?
748,What spices can enhance the flavor of beef?
748,Which herbs work well with beef dishes?
748,How can I incorporate alcohol into my beef recipes?
748,What are some unusual ingredients to pair with beef?
748,Can you suggest savory sauces to complement beef?
749,What quality greens should I use for a balanced salad?
749,Can you suggest some subtle herbs that work well in salads?
749,What sweet-tart elements can enhance my salad flavor?
749,How do I add richness to my salad with nuts or cheese?
749,What ingredients make a well-balanced vinaigrette for my salad?
750,What ingredients can I use to enhance umami in my cooking?
750,How does slow cooking affect the savory taste in a dish?
750,Can you explain how to use fermented products for umami flavor?
750,What role does salt play in developing a dish's complexity?
750,How can vinegar be used to improve umami?
751,What ingredients are included in the chili rub for the rib eye steak?
751,How do I apply the chili rub to the steak for the best flavor?
751,What cooking technique enhances the flavors of the rib eye steak?
751,Can you suggest alternative spices if I don't have ancho chile?
751,What temperature should I char the rib eye steak for optimal results?
752,What is the purpose of using peppercorns with coriander in a soup?
752,Can coriander enhance the flavor of other types of soups?
752,How do I create a nuanced broth using coriander?
752,What other ingredients can I pair with coriander in soups?
752,Is there a specific type of soup where coriander works best?
753,What dishes can Ibérico ham fat enhance?
753,How does rendered fat of Ibérico ham improve scrambled eggs?
753,In what way can Ibérico ham fat flavor a tortilla?
753,What is the best way to enjoy the flavor of Ibérico ham fat?
753,Why is Ibérico ham fat considered flavorful?
754,What combination can enhance shrimp flavor with sweetness and heat?
754,How can I incorporate French elements to shrimp dishes?
754,What ingredients can I use to create vibrant aromas with shrimp?
754,How do chiles and lime juice work together in shrimp recipes?
754,What role does brown sugar play in layering shrimp flavors?
755,What types of bread have a neutral flavor?
755,How can I enhance my cheese platter with fruits?
755,Are there specific fruits that pair well with cheese?
755,What should I avoid when selecting bread for cheese?
755,Can you suggest bread options that complement various cheeses?
756,What is the best way to prepare napa cabbage for a salad?
756,Can you suggest compatible ingredients for napa cabbage dishes?
756,How long should I soak napa cabbage in ice water?
756,Are there any specific cooking techniques to enhance napa cabbage's texture?
756,Which seasonings pair well with napa cabbage for stir-fry?
757,What impact do cloves have on the taste of lamb?
757,Can cloves enhance the flavor profile of lamb dishes?
757,How do cloves influence the overall richness of lamb?
757,Are cloves overpowering when used in lamb recipes?
757,What flavor characteristics do cloves bring to lamb?
758,What are the benefits of using nuts in recipes?
758,How do I toast nuts properly before adding them to dishes?
758,Can nuts enhance both sweet and savory meals?
758,What types of dishes commonly use nuts for added texture?
758,How do I prevent nuts from becoming soggy in my cooking?
759,What are the different methods of obtaining salt?
759,Can you explain the process of purifying salt?
759,What impurities are typically removed during salt purification?
759,How does seawater evaporation work for salt extraction?
759,Are there different types of salt based on their sourcing?
760,What is the best cooking time for calf liver?
760,How can I ensure that calf liver stays tender?
760,What happens if I overcook calf liver?
760,What cooking method should I use for calf liver?
760,Can you recommend any seasonings for calf liver?
761,What are some examples of flavor trios in cooking?
761,How can I use flavor trios to enhance my dishes?
761,Are there specific ingredients that form effective flavor cliques?
761,What techniques can I use to build complex flavor profiles?
761,Can flavor trios be used in desserts as well?
762,What fruits go well with Vacherin cheese?
762,How can I present Vacherin cheese elegantly?
762,Are there any nuts that pair nicely with Vacherin?
762,What is the texture of Vacherin cheese like?
762,Can you suggest a simple dish using Vacherin cheese?
763,Which dishes pair best with sumac?
763,Can you explain how sumac is used in Middle Eastern cooking?
763,What herbs complement sumac when cooking?
763,Is sumac used in Turkish dishes?
763,What are some ingredients that go well with sumac?
764,What vegetables go well with chervil?
764,Can you suggest some meats that pair with chervil?
764,Is chervil suitable for seafood dishes?
764,How can I use chervil in sauces?
764,What is the fines herbes concept in cooking with chervil?
765,How does malt enhance the flavor of chocolate desserts?
765,What is the role of malt in baking sweet treats?
